"id";"parent_id";"level";"objectid";"objecttype";"querystatus";"querytime";"querytype";"message"
"18069";"17317";"1";"81386795687_10153603031820688";"data";"fetched (200)";"2016-10-09 20:23:56.081000";"Facebook:<user>/posts";"Der CSU-Fraktionsvorsitzende im Bayerischen Landtag Thomas Kreuzer CSU ist heute um 23:05 Uhr zu Gast bei Anne Will in der ARD. 

Für ihn gilt in der aktuellen Flüchtlingssituation: Flüchtlingszustrom eindämmen – Schutzbedürftigen helfen! Einschalten lohnt sich! #CSUTvTipp"
"18070";"17317";"1";"81386795687_10153603040870688";"data";"fetched (200)";"2016-10-09 20:23:56.081000";"Facebook:<user>/posts";"Während BÜNDNIS 90/DIE GRÜNEN in der Flüchtlingsdebatte nur klug daherreden, krempelt Bayern die Ärmel hoch und handelt! 

Flüchtlingszustrom eindämmen – Schutzbedürftigen helfen! Nur so lässt sich die Solidarität in der Bevölkerung aufrechterhalten."
"18071";"17317";"1";"CSU";"offcut";"fetched (200)";"2016-10-09 20:23:56.081000";"Facebook:<user>/posts";""
"18072";"17317";"1";"81386795687_10153602753815688";"data";"fetched (200)";"2016-10-09 20:23:59.139000";"Facebook:<user>/posts";"Bayern bleibt Spitzenreiter im deutschlandweiten Vergleich der Arbeitsmarktzahlen.  

Wirtschaftsministerin Ilse Aigner betont die enorme Leistungsfähigkeit der bayerischen Wirtschaft. #löwenstark"
"18073";"17317";"1";"81386795687_10153601392635688";"data";"fetched (200)";"2016-10-09 20:23:59.139000";"Facebook:<user>/posts";"Edmund Stoiber spricht #Klartext: Wer in Deutschland leben will, muss die deutsche Leitkultur akzeptieren."
"18074";"17317";"1";"81386795687_10153601188445688";"data";"fetched (200)";"2016-10-09 20:23:59.139000";"Facebook:<user>/posts";"Horst Seehofer hat von der Bundesregierung ein klares Bekenntnis zur Begrenzung der Flüchtlingszahlen gefordert.

Er machte zudem deutlich, dass die Bayerische Staatsregierung trotz der Mega-Aufgabe des Flüchtlingszustroms die Leistungen für die einheimische Bevölkerung nicht einschränken werde."
"18075";"17317";"1";"81386795687_10153600948860688";"data";"fetched (200)";"2016-10-09 20:23:59.139000";"Facebook:<user>/posts";"Ilse Aigner macht angesichts der aktuellen Flüchtlingssituation klar: Es braucht strenge und schnelle Verfahren und konsequentes Zurückführen derer, die kein Bleiberecht haben. 

Deshalb steht das Thema Asyl auch heute wieder auf der Tagesordnung im Kabinett. Alle aktuellen Infos dazu erfahrt ihr wie immer bei uns."
"18076";"17317";"1";"81386795687_10153599262090688";"data";"fetched (200)";"2016-10-09 20:23:59.139000";"Facebook:<user>/posts";"Heute gibt es ein weiteres Geburtstagskind: Wir gratulieren der Bayerischen Sozialministerin Emilia Müller sehr herzlich zu ihrem 64. Geburtstag! #oisguade"
"18077";"17317";"1";"81386795687_10153598996210688";"data";"fetched (200)";"2016-10-09 20:23:59.139000";"Facebook:<user>/posts";"Heute feiert der CSU-Ehrenvorsitzende und langjährige Bayerische Ministerpräsident Edmund Stoiber seinen 74. Geburtstag. Wir wünschen ihm alles Gute! #oisguade"
"18078";"17317";"1";"81386795687_10153593590600688";"data";"fetched (200)";"2016-10-09 20:23:59.139000";"Facebook:<user>/posts";"Wie war das eigentlich damals mit dem Milliardenkredit für die DDR? 

Edmund Stoiber erklärt, wie Franz Josef Strauß mit diesem Coup einen wichtigen Grundstein für die spätere Deutsche Einheit legte. #100JahreFJS"
"18079";"17317";"1";"81386795687_10153597376370688";"data";"fetched (200)";"2016-10-09 20:23:59.139000";"Facebook:<user>/posts";"Unser Schnappschuss der Woche: Horst Seehofer mit seiner Frau Karin beim traditionellen Trachten- und Schützenzug zum Münchner Oktoberfest. Euch allen noch eine schöne Wiesn! #brauchtumbrauchts"
"18080";"17317";"1";"81386795687_10153594038905688";"data";"fetched (200)";"2016-10-09 20:23:59.139000";"Facebook:<user>/posts";"Wir gratulieren unserem Generalsekretär Andreas Scheuer herzlich zum Geburtstag! #oisguade"
"18081";"17317";"1";"81386795687_10153595285790688";"data";"fetched (200)";"2016-10-09 20:23:59.139000";"Facebook:<user>/posts";"Wir wünschen euch ein schönes Wochenende und eine gemütliche Wiesnzeit! #miasanbayern"
"18082";"17317";"1";"81386795687_10153594217965688";"data";"fetched (200)";"2016-10-09 20:23:59.139000";"Facebook:<user>/posts";"Bayern zahlt das Betreuungsgeld weiter!"
"18083";"17317";"1";"81386795687_10153594002715688";"data";"fetched (200)";"2016-10-09 20:23:59.139000";"Facebook:<user>/posts";"Wichtiger Zwischenschritt: Bund und Länder haben beim Asylgipfel beschlossen, dass die Länder mehr Geld vom Bund bekommen und härtere Maßnahmen gegen Asylmissbrauch eingeführt werden, um die Anreizwirkung zu reduzieren. 

Damit wurden die bayerischen Anliegen auf ganzer Breite durchgesetzt."
"18084";"17317";"1";"81386795687_10153593810210688";"data";"fetched (200)";"2016-10-09 20:23:59.139000";"Facebook:<user>/posts";"#löwenstark: Eine große Mehrheit befürwortet die Positionen der CSU in der aktuellen Flüchtlingsdebatte. 
 
Drückt auf „gefällt mir“, wenn ihr ebenfalls eine Obergrenze für die Aufnahme von Asylbewerbern und die Einführung von Grenzkontrollen befürwortet."
"18085";"17317";"1";"81386795687_10153592219220688";"data";"fetched (200)";"2016-10-09 20:23:59.139000";"Facebook:<user>/posts";"Die CSU-Fraktion im Bayerischen Landtag hat auf ihrer Klausurtagung in Kloster Banz eine umfassende Resolution mit dem Titel ""Flüchtlingszustrom eindämmen – Schutzbedürftigen helfen!"" zur Lösung der Flüchtlingsproblematik beschlossen."
"18086";"17317";"1";"81386795687_10153591836560688";"data";"fetched (200)";"2016-10-09 20:23:59.139000";"Facebook:<user>/posts";"Andreas Scheuer fordert klare Regeln bei der Integration.
 
Wir müssen verhindern, dass Menschen, die zu uns kommen, neben uns oder gegen uns leben in Deutschland. Sprache, Werte, Grundordnung und Kultur sind maßgebliche Pfeiler unseres Zusammenlebens."
"18087";"17317";"1";"81386795687_10153590469935688";"data";"fetched (200)";"2016-10-09 20:23:59.139000";"Facebook:<user>/posts";"Andreas Scheuer kritisiert die Klage der EU-Kommission gegen Deutschland scharf. 
 
In Deutschland ist die Belastungsgrenze für die Aufnahme von Flüchtlingen deutlich überschritten. Die EU selbst versagt bei der Bewältigung der Flüchtlingskrise völlig. Und nun will die EU noch eine Ausweitung der Zuzugsregeln durchsetzen."
"18088";"17317";"1";"81386795687_10153590367230688";"data";"fetched (200)";"2016-10-09 20:23:59.139000";"Facebook:<user>/posts";"Die chaotischen Verhältnisse in Europa müssen endlich beendet werden. Ungarn ist dabei unverzichtbar für eine wirkliche Lösung des Problems. 

Gemeinsam mit dem ungarischen Regierungschef Viktor Orban diskutierte die CSU-Fraktion im Bayerischen Landtag deshalb heute die aktuelle Flüchtlingssituation."
"18089";"17317";"1";"81386795687_10153590048950688";"data";"fetched (200)";"2016-10-09 20:23:59.139000";"Facebook:<user>/posts";"EVP-Fraktionschef Manfred Weber kritisiert EU-Staaten, die die Sicherung ihrer Außengrenzen vernachlässigen und fordert Europa auf das Kommando zu übernehmen und durchzugreifen.
 
Wir können in Europa nicht alle 60 Millionen Menschen aufnehmen, die derzeit auf der Flucht sind."
"18090";"17317";"1";"81386795687_10153589084215688";"data";"fetched (200)";"2016-10-09 20:23:59.139000";"Facebook:<user>/posts";"Gleich ist Bundesentwicklungsminister Gerd Müller zu Gast in der Münchner Runde. Die Sendung zur aktuellen Flüchtlingssituation startet um 22:00 Uhr im BR. 

Einschalten lohnt sich! #CSUTvTipp"
"18091";"17317";"1";"81386795687_10153589014670688";"data";"fetched (200)";"2016-10-09 20:23:59.139000";"Facebook:<user>/posts";"Bayern wird den regelfreien Zustand der unkontrollierten Einreise von Flüchtlingen nicht länger hinnehmen. Wenn der Bund keine Lösungen liefert, wird Bayern notfalls eigene Antworten finden.

CSU-Chef Horst Seehofer hat auf der Klausurtagung der CSU-Fraktion im Bayerischen Landtag bekräftigt, dass der aktuelle Ausnahmezustand in der Flüchtlingspolitik sofort beendet werden muss."
"18092";"17317";"1";"81386795687_10153588682480688";"data";"fetched (200)";"2016-10-09 20:23:59.139000";"Facebook:<user>/posts";"Die übermäßige Belastung Bayerns in der aktuellen Flüchtlingskrise ist nicht hinnehmbar!

CSU-Chef Horst Seehofer fordert die Europäische Union, 
aber auch Bund und Länder ultimativ zum Handeln auf, um die Flüchtlinge gerechter zu verteilen und den Zustrom endlich zu begrenzen."
"18093";"17317";"1";"81386795687_1472163209756942";"data";"fetched (200)";"2016-10-09 20:23:59.139000";"Facebook:<user>/posts";""
"18094";"17317";"1";"81386795687_10153588075230688";"data";"fetched (200)";"2016-10-09 20:23:59.139000";"Facebook:<user>/posts";"Heute trifft sich die CSU-Fraktion im Bayerischen Landtag zu ihrer Klausurtagung in Kloster Banz. 

Horst Seehofer spricht #Klartext zur Begrenzung von Zuwanderung: „Es fehlt ja nicht am guten Willen. Es geht um die objektiven Möglichkeiten - und da haben wir die Belastungsgrenze überschritten.“"
"18095";"17317";"1";"81386795687_10153586412195688";"data";"fetched (200)";"2016-10-09 20:23:59.139000";"Facebook:<user>/posts";"Die elektronische Gesundheitskarte an Flüchtlinge zu vergeben, ist der falsche Weg. Das führt zu nicht kontrollierbaren Leistungsausweitungen und erweckt in den Herkunftsländern den Eindruck einer umfassenden kostenlosen Gesundheitsversorgung in Deutschland. 

Das bisherige System mit Berechtigungsscheinen des Sozialamts für die medizinische Behandlung von Flüchtlingen hat sich bewährt, und wir sollten dabei bleiben."
"18096";"17317";"1";"81386795687_10153586200380688";"data";"fetched (200)";"2016-10-09 20:23:59.139000";"Facebook:<user>/posts";"Alle europäischen Regeln sind faktisch außer Kraft. Deutschland hat nicht nur massenhaften Flüchtlingszustrom, sondern mittlerweile einfach unkontrollierte Migration. Das geht so nicht! 

Menschen kommen zu uns, die registriert sind, sicher untergebracht waren in anderen europäischen Staaten und jetzt einfach nach Deutschland wollen. Das ist in dieser Menge einfach nicht zu schultern."
"18097";"17317";"1";"CSU";"offcut";"fetched (200)";"2016-10-09 20:23:59.139000";"Facebook:<user>/posts";""
"18098";"17317";"1";"81386795687_10153585797310688";"data";"fetched (200)";"2016-10-09 20:24:02.311000";"Facebook:<user>/posts";"Deutschland hat eine gewachsene Leitkultur, die auch im Grundgesetz festgeschrieben ist: Toleranz, Presse- und Religionsfreiheit und zum Beispiel unser Verhältnis zu Israel. 

Diese Leitkultur des Grundgesetzes kann nicht zur Disposition stehen – ganz gleich, wie viele Zuwanderer zu uns kommen."
"18099";"17317";"1";"81386795687_10153585704805688";"data";"fetched (200)";"2016-10-09 20:24:02.311000";"Facebook:<user>/posts";"Wir gratulieren dem Bayerischen Innenminister Joachim Herrmann herzlich zu seinem 59. Geburtstag! Alles Gute für das neue Lebensjahr."
"18100";"17317";"1";"81386795687_10153583130200688";"data";"fetched (200)";"2016-10-09 20:24:02.311000";"Facebook:<user>/posts";"Förderung des politischen Nachwuchses: Der aktuelle Jahrgang der CSU-Akademie traf sich zur ""Denkwerkstatt"" im niederbayerischen Kloster Niederaltaich. Die CSU-Akademie bietet jungen Politikern zusätzlich zu ihren eigenen politischen Erfahrungen vor Ort ein umfassendes und vielfältiges Schulungsprogramm."
"18101";"17317";"1";"81386795687_10153578914230688";"data";"fetched (200)";"2016-10-09 20:24:02.311000";"Facebook:<user>/posts";"Tolle Stimmung und hochkarätige Gäste diese Woche bei „Andreas Scheuer – Guests & Friends“ in Ingolstadt. Der CSU-Generalsekretär im Gespräch mit dem CSU-Ehrenvorsitzenden Theo Waigel und Spiegel-Journalist Jan Fleischhauer. Thema „Von Franz Josef Strauß in die Online-Zukunft − der Wandel unserer Mediendemokratie“."
"18102";"17317";"1";"81386795687_10153580674905688";"data";"fetched (200)";"2016-10-09 20:24:02.311000";"Facebook:<user>/posts";"Wir wünschen euch ein schönes Wochenende, diesmal mit einem wunderbaren Ausblick vom Branderschrofen bei Schwangau in Schwaben! #miasanbayern"
"18103";"17317";"1";"81386795687_10153578968440688";"data";"fetched (200)";"2016-10-09 20:24:02.311000";"Facebook:<user>/posts";"Bayern hat einen Stab zur Koordinierung der Flüchtlingsströme eingerichtet. Innenminister Joachim Herrmann: ""Ich habe die klare Erwartung an den Koordinierungsstab, dass die Weiterleitung der Flüchtlinge in die Aufnahmeeinrichtungen nach der ersten Kontrolle in einem geordneten Verfahren stattfindet. Es darf hier keine Sicherheitslücken geben."""
"18104";"17317";"1";"81386795687_10153578485770688";"data";"fetched (200)";"2016-10-09 20:24:02.311000";"Facebook:<user>/posts";"Bundesentwicklungsminister Gerd Müller hat mit Königin Rania von Jordanien über die Lage der Flüchtlinge und die Winterhilfe Deutschlands für die Region gesprochen. 

630.000 syrische Flüchtlinge sind seit 2012 in das Land mit rund sechs Millionen Einwohnern gekommen. Deutschland unterstützt Jordanien dabei, kommunale Strukturen zu stärken und sowohl Flüchtlingen als auch Jordaniern Überlebensmöglichkeiten und Perspektiven vor Ort zu verschaffen. (Foto: BMZ-photothek)"
"18105";"17317";"1";"81386795687_10153576779260688";"data";"fetched (200)";"2016-10-09 20:24:02.311000";"Facebook:<user>/posts";"#CSUtvTipp: Heute Abend diskutiert Andreas Scheuer um 22.15 Uhr im ZDF bei Maybrit Illner über die Frage ""Millionen auf der Flucht – wie schaffen wir das?"". Einschalten lohnt sich!"
"18106";"17317";"1";"81386795687_10153576573085688";"data";"fetched (200)";"2016-10-09 20:24:02.311000";"Facebook:<user>/posts";"Die neue Umfrage von SAT.1 Bayern zeigt die große Zustimmung für unsere Politik. Generalsekretär Andreas Scheuer betont: „Diese Umfragewerte sind eine eindeutige Bestätigung aus der Bevölkerung für unseren klaren Kurs vor allem in der Asyl- und Flüchtlingspolitik. Die CSU ist die Stimme der Vernunft und die Bevölkerung bestätigt: Die CSU liegt richtig!"" #löwenstark"
"18107";"17317";"1";"81386795687_10153574818500688";"data";"fetched (200)";"2016-10-09 20:24:02.311000";"Facebook:<user>/posts";"Monika Hohlmeier erinnert sich an ihren Vater Franz Josef Strauß: ""Er war wirklich mit Leidenschaft und Freude Vater. Er musste nicht immer da sein, aber wir konnten uns auf ihn verlassen."" #100JahreFJS"
"18108";"17317";"1";"81386795687_10153574914770688";"data";"fetched (200)";"2016-10-09 20:24:02.311000";"Facebook:<user>/posts";"Europaministerin Beate Merk stellt klar: „Unsere Flüchtlingspolitik ist aktuell zu einseitig auf die Bewältigung der Folgen des Flüchtlingszustroms hier bei uns in Europa ausgerichtet. Wesentlich wichtiger ist die Bekämpfung der Fluchtursachen.“"
"18109";"17317";"1";"81386795687_10153574609245688";"data";"fetched (200)";"2016-10-09 20:24:02.311000";"Facebook:<user>/posts";"Generalsekretär Andreas Scheuer betont die Notwendigkeit der Grenzkontrollen zwischen Bayern und Österreich. Ohne die Bekämpfung der Fluchtursachen wird der massenhafte Zustrom nach Europa nicht abebben."
"18110";"17317";"1";"81386795687_10153572774140688";"data";"fetched (200)";"2016-10-09 20:24:02.311000";"Facebook:<user>/posts";"„Wir sind nicht unbegrenzt in der Lage, zu helfen“, macht Staatskanzleichef Marcel Huber mit Blick auf die Flüchtlingssituation klar. 

Mehr dazu und zu dem beschlossenen Maßnahmenpaket erfahrt ihr hier."
"18111";"17317";"1";"81386795687_10153572352965688";"data";"fetched (200)";"2016-10-09 20:24:02.311000";"Facebook:<user>/posts";"Heute Abend ist um 22:00 Uhr die Bayerische Wirtschaftsministerin Ilse Aigner zu Gast bei der Münchner Runde im BR. 

Diskussionsthema wird die aktuelle Flüchtlingssituation sein. Einschalten lohnt sich! #CSUTvTipp"
"18112";"17317";"1";"81386795687_10153571648220688";"data";"fetched (200)";"2016-10-09 20:24:02.311000";"Facebook:<user>/posts";"Heute ist der 1. Schultag nach den Sommerferien. Wir wünschen allen Schülern - besonders unseren ABC-Schützen – und allen Lehrern einen guten Start in das neue Schuljahr!"
"18113";"17317";"1";"81386795687_10153570165535688";"data";"fetched (200)";"2016-10-09 20:24:02.311000";"Facebook:<user>/posts";"Heute Abend um 20:30 Uhr ist Markus Söder zu Gast bei hart aber fair in der ARD. Thema: Die Bewältigung der Flüchtlingssituation. Einschalten lohnt sich! #CSUTvTipp"
"18114";"17317";"1";"81386795687_10153570016940688";"data";"fetched (200)";"2016-10-09 20:24:02.311000";"Facebook:<user>/posts";"Joachim Herrmann spricht #Klartext: ""Wir gewährleisten das Asylrecht in Deutschland, aber wir brauchen wieder klare Kontrollen an unseren Grenzen."""
"18115";"17317";"1";"81386795687_10153569472645688";"data";"fetched (200)";"2016-10-09 20:24:02.311000";"Facebook:<user>/posts";"Horst Seehofer machte vor der heutigen Parteivorstandssitzung in München deutlich: Die Bevölkerung erwartet, dass wir in der aktuellen Flüchtlingssituation #Klartext reden und die Probleme lösen.

Wir haben eine zweifache Verantwortung: Zum einen die humanitäre Aufnahme der Flüchtlinge. Zum anderen müssen wir die Probleme berücksichtigen, die die Bevölkerung sieht. Nur so lässt sich Solidarität erhalten."
"18116";"17317";"1";"81386795687_10153566548175688";"data";"fetched (200)";"2016-10-09 20:24:02.311000";"Facebook:<user>/posts";"Wichtiges Signal! Auf bayerische Initiative hin führt Deutschland vorübergehend wieder Grenzkontrollen ein.

Außerdem hat die Bayerische Staatsregierung ein 12-Punkte-Sofortprogramm zur Bewältigung der Flüchtlingssituation beschlossen."
"18117";"17317";"1";"81386795687_10153565287180688";"data";"fetched (200)";"2016-10-09 20:24:02.311000";"Facebook:<user>/posts";"Entwicklungsminister Gerd Müller trifft den früheren UN-Generalsekretär Kofi Annan auf der Afrika-Konferenz in Berlin. 

Thema des Gesprächs: Wie kann die Schleuserkriminalität wirksam bekämpft werden?
(Foto: BMZ)"
"18118";"17317";"1";"81386795687_10153564184545688";"data";"fetched (200)";"2016-10-09 20:24:02.311000";"Facebook:<user>/posts";"An diesem Wochenende haben in Bayern die Almabtriebe begonnen. Wir wünschen ein gutes Gelingen und euch allen einen schönen Sonntag! #miasanbayern #brauchtumbrauchts"
"18119";"17317";"1";"81386795687_10153562559880688";"data";"fetched (200)";"2016-10-09 20:24:02.311000";"Facebook:<user>/posts";"CSU-Ehrenvorsitzender Edmund Stoiber spricht #Klartext im Interview mit DIE WELT. Absolut lesenswert!"
"18120";"17317";"1";"81386795687_10153560040705688";"data";"fetched (200)";"2016-10-09 20:24:02.311000";"Facebook:<user>/posts";"CSU-Chef Horst Seehofer kritisiert, dass Flüchtlinge unkontrolliert über die Balkanroute nach Deutschland kommen können.

Deutschland steht sonst vor einer nicht mehr zu beherrschenden Notlage."
"18121";"17317";"1";"81386795687_10153560114595688";"data";"fetched (200)";"2016-10-09 20:24:02.311000";"Facebook:<user>/posts";"Statt aus dem fernen Berlin abgehobene Reden zu schwingen, sollte Herr Oppermann die humanitären Leistungen der bayerischen Helfer und Beamten vor Ort anerkennen und würdigen. 

Bayern stemmt bei weitem die Hauptlast bei der Bewältigung des Flüchtlingszustroms. Die CSU hat vor Monaten einen Maßnahmenkatalog vorgelegt. Es gilt jetzt, konkrete politische Entscheidungen zu treffen."
"18122";"17317";"1";"81386795687_10153559781945688";"data";"fetched (200)";"2016-10-09 20:24:02.311000";"Facebook:<user>/posts";"Alexander Dobrindt,MdB spricht #Klartext im Bundestag."
"18123";"17317";"1";"CSU";"offcut";"fetched (200)";"2016-10-09 20:24:02.311000";"Facebook:<user>/posts";""
"18124";"17317";"1";"81386795687_10153557328980688";"data";"fetched (200)";"2016-10-09 20:24:05.697000";"Facebook:<user>/posts";"Franz Josef Strauß hat sich massiv für die Soziale Marktwirtschaft in Deutschland eingesetzt. 

CSU-Ehrenvorsitzender Edmund Stoiber lobt sein Engagement: ""Strauß hat sich dem verschrieben und damit eine unglaubliche Weichenstellung in Deutschland bis heute gelegt.""  #100JahreFJS"
"18125";"17317";"1";"81386795687_10153557009455688";"data";"fetched (200)";"2016-10-09 20:24:05.697000";"Facebook:<user>/posts";"Heute Abend um 22:15 Uhr ist der Bayerische Finanzminister Markus Söder zu Gast bei Maybrit Illner im ZDF. Diskutiert wird über das Thema: ""Deutschland hilft – doch wer hilft uns helfen?"". Einschalten lohnt sich! #CSUTvTipp"
"18126";"17317";"1";"81386795687_10153556228570688";"data";"fetched (200)";"2016-10-09 20:24:05.697000";"Facebook:<user>/posts";"Generalsekretär Andreas Scheuer wird nächsten Dienstag in Ingolstadt mit Jan Fleischhauer und Dr. Theo Waigel über das Thema: ""Von Franz Josef Strauß in die Online-Zukunft - der Wandel unserer Mediendemokratie"" diskutieren. Alle Infos gibt's hier:"
"18127";"17317";"1";"81386795687_10153554299625688";"data";"fetched (200)";"2016-10-09 20:24:05.697000";"Facebook:<user>/posts";"Wir gratulieren der bayerischen Gesundheitsministerin Melanie Huml herzlich zu ihrem Geburtstag! #OisGuade"
"18128";"17317";"1";"81386795687_10153550867435688";"data";"fetched (200)";"2016-10-09 20:24:05.697000";"Facebook:<user>/posts";"""Er war gradheraus, ehrlich, ein waschechter Bayer!""

Die CSU hat in Rott am Inn den 100. Geburtstag des früheren Parteivorsitzenden und langjährigen Bayerischen Ministerpräsidenten Franz Josef Strauß begangen. Das sind die schönsten Momente der Gedenkfeier."
"18129";"17317";"1";"81386795687_10153549288830688";"data";"fetched (200)";"2016-10-09 20:24:05.697000";"Facebook:<user>/posts";"In der aktuellen Flüchtlingsdebatte wollen wir einen Moment inne halten, um den vielen Beamten, Ärzten, Behördenvertretern, Hilfsorganisationen, Ehrenamtlichen und Freiwilligen zu danken. Sie sorgen mit ihrem unermüdlichen Einsatz dafür, dass denjenigen, die vor Krieg und Vertreibung fliehen, so großartige Hilfe zuteil wird. 
 
Bayern zeigt einmal mehr, dass es große Herausforderungen stemmen kann. Danke für Euer Engagement!"
"18130";"17317";"1";"81386795687_10153549254725688";"data";"fetched (200)";"2016-10-09 20:24:05.697000";"Facebook:<user>/posts";"Bayerns Finanzminister Markus Söder  hat auf dem traditionellen Gillamoos-Volksfest die immense Hilfsbereitschaft für die in Deutschland ankommenden Flüchtlinge gewürdigt. Er betonte aber auch, dass bei aller Hilfe für den Moment darauf geachtet werden müsse, das eigene Land und die Menschen hierzulande nicht zu überfordern. 

Die Koalitionsbeschlüsse der vergangenen Nacht sind ein wichtiger Schritt in die richtige Richtung."
"18131";"17317";"1";"81386795687_10153549043575688";"data";"fetched (200)";"2016-10-09 20:24:05.697000";"Facebook:<user>/posts";"CSU-Chef Horst Seehofer hat beim gestrigen Koalitionsgipfel wesentliche Punkte der CSU in der Asylpolitik durchgesetzt und macht deutlich: 

""Wir können auf Dauer bei 28 Mitgliedsstaaten in der Europäischen Union nicht beinahe sämtliche Flüchtlinge aufnehmen, die aus allen Ländern dieser Welt kommen. Das hält auf Dauer keine Gesellschaft aus. Wir helfen, aber wir brauchen auch Gerechtigkeit"""
"18132";"17317";"1";"81386795687_10153548404000688";"data";"fetched (200)";"2016-10-09 20:24:05.697000";"Facebook:<user>/posts";"Die Koalitionsbeschlüsse zur Flüchtlingspolitik sind ein wichtiger Zwischenschritt, um Menschlichkeit und Ordnung bei der Asylfrage sicherzustellen. 

Jetzt kann es heißen: mehr Konzentration auf die wirklich Schutzbedürftigen und eine Überforderung Deutschlands verhindern."
"18133";"17317";"1";"81386795687_10153545966735688";"data";"fetched (200)";"2016-10-09 20:24:05.697000";"Facebook:<user>/posts";"Franz Josef Strauß ist einer der Baumeister der Bundesrepublik Deutschland und der Vater des modernen Bayern. 

Am Rande der Gedenkfeier zu #100JahreFJS sprachen Horst Seehofer, Andreas Scheuer und Edmund Stoiber über die CSU-Legende."
"18134";"17317";"1";"81386795687_10153545450260688";"data";"fetched (200)";"2016-10-09 20:24:05.697000";"Facebook:<user>/posts";"CSU-Legende Franz Josef Strauß wäre heute 100 Jahre alt geworden. Aus diesem Anlass gibt es in Rott am Inn große Gedenkfeiern. 

FJS hat Bayern und die CSU geprägt wie kein anderer. Sein Erbe ist unser Auftrag. #100JahreFJS"
"18135";"17317";"1";"81386795687_10153542638010688";"data";"fetched (200)";"2016-10-09 20:24:05.697000";"Facebook:<user>/posts";"Wir wünschen euch ein schönes Wochenende! #miasanbayern"
"18136";"17317";"1";"81386795687_10153540295140688";"data";"fetched (200)";"2016-10-09 20:24:05.697000";"Facebook:<user>/posts";"Startschuss für die Mobilität der Zukunft: Bundesverkehrsminister Alexander Dobrindt,MdB hat gemeinsam mit Vertretern des Freistaats Bayern, der Automobilindustrie und der IT-Wirtschaft die „Innovationscharta für das Digitale Testfeld Autobahn“ unterzeichnet. 

Damit haben die Beteiligten vereinbart, das Digitale Testfeld Autobahn auf der A9 in Bayern gemeinsam einzurichten und zu betreiben. Auf der Teststrecke sollen Innovationen der Mobilität 4.0 erprobt, bewertet und weiterentwickelt werden können."
"18137";"17317";"1";"81386795687_10153539678455688";"data";"fetched (200)";"2016-10-09 20:24:05.697000";"Facebook:<user>/posts";"Wir trauern um Markus Sackmann. Unsere Gedanken und unser Mitgefühl sind in diesen schweren Stunden bei seiner Familie und seinen Freunden. Mit ihm verlieren wir nicht nur einen liebenswürdigen und allseits beliebten Menschen, sondern auch einen über die Parteigrenzen hinweg geschätzten Politiker.

Markus Sackmann hat sein ganzes Berufsleben in den Dienst der bayerischen Bevölkerung gestellt. Seine Heimat und vor allem die Menschen lagen ihm stets am Herzen. Wir haben Markus Sackmann viel zu verdanken."
