"id";"parent_id";"level";"objectid";"objecttype";"querystatus";"querytime";"querytype";"message"
"18803";"17317";"1";"81386795687_10152742767780688";"data";"fetched (200)";"2016-10-09 20:25:22.367000";"Facebook:<user>/posts";"In Straubing läuft die Diskussion mit Andreas Scheuer, Charlotte Knobloch und Julian Reichelt. Folgt der Diskussion auf www.twitter.com/CSU oder im Livestream auf bit.ly/1sa4wtB! #AStalk"
"18804";"17317";"1";"81386795687_10152741837775688";"data";"fetched (200)";"2016-10-09 20:25:22.367000";"Facebook:<user>/posts";"Heute Abend diskutiert Andreas Scheuer mit Dr. h.c. Charlotte Knobloch, Präsidentin der Israelitischen Kultusgemeinde München und Oberbayern sowie Julian Reichelt, Chefredakteur von BILD.de und ehem. Kriegsreporter über das Thema „Angst vor den Krisen in der Welt?“

Ihr könnt bereits jetzt eure Fragen an die Teilnehmer posten! #AStalk"
"18805";"17317";"1";"81386795687_10152741498395688";"data";"fetched (200)";"2016-10-09 20:25:22.367000";"Facebook:<user>/posts";"Viele ISIS-Kämpfer aus Deutschland beziehen offenbar Sozialleistungen. Für uns ist klar: Es darf keine Sozialleistungen für Dschihadisten geben. 

Die Leistungen an diese Terror-Schmarotzer gehören sofort unterbunden."
"18806";"17317";"1";"81386795687_10152732630660688";"data";"fetched (200)";"2016-10-09 20:25:22.367000";"Facebook:<user>/posts";"Angst vor den Krisen in der Welt? Das ist das Thema bei ""Andreas Scheuer – Guests & Friends“ am Montagabend in Straubing. Zu Gast sind Dr. h.c. Charlotte Knobloch, Präsidentin der Israelitischen Kultusgemeinde München und Oberbayern sowie Julian Reichelt, Chefredakteur von BILD.de und ehem. Kriegsreporter. 

Ihr habt Lust und Zeit teilzunehmen? Dann meldet Euch hier an: http://on.fb.me/1EouShY #AStalk"
"18807";"17317";"1";"81386795687_10152730272835688";"data";"fetched (200)";"2016-10-09 20:25:22.367000";"Facebook:<user>/posts";""
"18808";"17317";"1";"81386795687_10152729888725688";"data";"fetched (200)";"2016-10-09 20:25:22.367000";"Facebook:<user>/posts";"Heute haben 12 kurdische Aktivisten mit Nähe zur PKK den Eingangsbereich der CSU-Parteizentrale besetzt. Sie haben u.a. gefordert, das PKK-Verbot aufzuheben. Nach etwa einer Stunde haben die Personen das Gelände friedlich wieder verlassen. Wir missbilligen diese Aktion entschieden. Die CSU unterstützt den internationalen Kampf gegen den ISIS-Terror und die humanitäre Hilfe für den Nordirak sowie Waffenlieferungen an die ISIS-Gegner.  Aber wir reichen nicht die Hand zu Aktionen, denen es um die Legalisierung terroristischer Organisationen geht."
"18809";"17317";"1";"81386795687_10152729293965688";"data";"fetched (200)";"2016-10-09 20:25:22.367000";"Facebook:<user>/posts";"Die Flüchtlingspolitik der EU ist weltfremd! Die Kommission muss dringend ihre Hilfe ausbauen! 

Andreas Scheuer: ""Hunderttausenden Flüchtlingen in Syrien, Nordirak und der Ukraine drohen Kälte, Not und Elend – die Jahreszeiten warten nicht, bis in Brüssel jeder Kommissar sein Büro eingerichtet hat.""

Mehr dazu hier: http://bit.ly/1sjf5Mn"
"18810";"17317";"1";"81386795687_566285313500013";"data";"fetched (200)";"2016-10-09 20:25:22.367000";"Facebook:<user>/posts";""
"18811";"17317";"1";"81386795687_10152726239150688";"data";"fetched (200)";"2016-10-09 20:25:22.367000";"Facebook:<user>/posts";"Bayern will Allgäuer Salafisten ausweisen! Mit dem Vorgehen gegen Erhan A. bekräftigt Innenminister Joachim Herrmann die klare Position der CSU gegen radikale Islamisten."
"18812";"17317";"1";"81386795687_10152724428385688";"data";"fetched (200)";"2016-10-09 20:25:22.367000";"Facebook:<user>/posts";"Gerade treffen sich die Spitzen von CSU, CDU und SPD zum Koalitionsausschuss im Bundeskanzleramt. Themen sind neben den Stromtrassen u. a. die Asylpolitik und die Lage bei der Bundeswehr."
"18813";"17317";"1";"81386795687_10152723776050688";"data";"fetched (200)";"2016-10-09 20:25:22.367000";"Facebook:<user>/posts";"Die Teilnehmer der Netzallianz haben in den vergangenen Monaten ein Kursbuch für den Ausbau des schnellen Internets in Deutschland erarbeitet, das fortlaufend weiterentwickelt wird. Das aktuelle Ergebnis wurde heute in Berlin vorgestellt. 

Ziel ist es, bis 2018 flächendeckend alle Haushalte mit 50 Mbit/s zu versorgen. #DigitaleAgenda"
"18814";"17317";"1";"81386795687_10152723089605688";"data";"fetched (200)";"2016-10-09 20:25:22.367000";"Facebook:<user>/posts";"Bei der Energiewende gilt es zu berücksichtigen, was die Bürger wollen. Deshalb setzen wir auf den Dialog mit der Bevölkerung.
 
Eines ist aber klar: Neue Stromtrassen werden in Bayern nur gebaut, wenn sie wirklich gebraucht werden."
"18815";"17317";"1";"81386795687_10152720518010688";"data";"fetched (200)";"2016-10-09 20:25:22.367000";"Facebook:<user>/posts";"Edmund Stoiber kämpft seit Jahren gegen die Reglementierungswut der EU. Kommende Woche wird er den Abschlussbericht seiner Arbeit vorlegen. 

Bereits heute stellte er Empfehlungen zum Bürokratieabbau vor. Stoiber fordert unter anderem, dass sich die EU auf die großen Fragen konzentriert und sich bei Detailregelungen zurückhält.

Alle Punkte findet ihr hier: http://bit.ly/1nadVlL"
"18816";"17317";"1";"81386795687_10152719834270688";"data";"fetched (200)";"2016-10-09 20:25:22.367000";"Facebook:<user>/posts";"Entwicklungsminister Gerd Müller war im Nordirak: Er fordert von der EU eine Sondermilliarde für die notleidenden Flüchtlinge und die Einsetzung eines Not-Flüchtlingskommissars."
"18817";"17317";"1";"81386795687_10152710711155688";"data";"fetched (200)";"2016-10-09 20:25:22.367000";"Facebook:<user>/posts";"Franz Josef Strauß war ein Kämpfer für die Deutsche Einheit – auch ihm ist es zu verdanken, dass wir heute in einem geeinten Deutschland leben dürfen.

Wir wünschen euch einen schönen Tag der Deutschen Einheit!"
"18818";"17317";"1";"81386795687_10152708780270688";"data";"fetched (200)";"2016-10-09 20:25:22.367000";"Facebook:<user>/posts";"CSU-Chef Horst Seehofer zieht ein Jahr nach der bayerischen Landtagswahl Bilanz und stellt das Kursbuch für die nächsten Monate vor.

Mehr zur Zwischenbilanz und den Schwerpunkten im Herbst:  http://bit.ly/1vADDQI"
"18819";"17317";"1";"81386795687_10152706131110688";"data";"fetched (200)";"2016-10-09 20:25:22.367000";"Facebook:<user>/posts";"In Birmingham findet gerade der Parteitag der Conservatives statt. Generalsekretär Andreas Scheuer ist als Vertreter der CSU vor Ort."
"18820";"17317";"1";"81386795687_10152705533810688";"data";"fetched (200)";"2016-10-09 20:25:22.367000";"Facebook:<user>/posts";"Finanzminister Markus Söder hat den Haushalt für 2015/2016 vorgelegt: Bayern wird den Schuldenabbau fortsetzen und gleichzeitig kräftig in Bildung und Zukunft investieren. #SolideFinanzen

Mehr dazu: http://bit.ly/1qUS9xk"
"18821";"17317";"1";"81386795687_10152704168035688";"data";"fetched (200)";"2016-10-09 20:25:22.367000";"Facebook:<user>/posts";"Heute besuchte Bundesinnenminister Thomas de Maizière Bayern, um sich ein Bild über die Situation der Flüchtlinge zu machen. Politisch Verfolgte müssen Asyl bekommen. Andererseits müssen die, die keinen Schutz brauchen, schneller in ihre Heimatländer zurückgebracht werden. 

Mehr dazu: http://bit.ly/1rASdGp"
"18822";"17317";"1";"81386795687_10152703916360688";"data";"fetched (200)";"2016-10-09 20:25:22.367000";"Facebook:<user>/posts";"Gysi schlägt allen Opfern der SED-Verbrechen kalt ins Gesicht. An die Adresse der SPD muss die klare Aufforderung gehen: Aufrechte Demokraten sagen Nein zu einer Koalition mit den SED-Unrechts-Verherrlichern!"
"18823";"17317";"1";"81386795687_711025938983128";"data";"fetched (200)";"2016-10-09 20:25:22.367000";"Facebook:<user>/posts";""
"18824";"17317";"1";"81386795687_10152702077080688";"data";"fetched (200)";"2016-10-09 20:25:22.367000";"Facebook:<user>/posts";"Finanzminister Markus Söder will nach 2019 nicht mehr für Berlin zahlen!"
"18825";"17317";"1";"CSU";"offcut";"fetched (200)";"2016-10-09 20:25:22.367000";"Facebook:<user>/posts";""
"18826";"17317";"1";"81386795687_10152701730605688";"data";"fetched (200)";"2016-10-09 20:25:24.949000";"Facebook:<user>/posts";"Finanz- und Haushaltspolitik in Bayern erhalten erneut erstklassige Noten der Rating-Agentur Standard & Poor's!

Mehr dazu: http://bit.ly/1rxxFzT"
"18827";"17317";"1";"81386795687_10152695897010688";"data";"fetched (200)";"2016-10-09 20:25:24.949000";"Facebook:<user>/posts";"Wir ziehen die Lehren aus dem Schottland-Referendum: Größere Eigenständigkeit Bayerns, weniger Reglementierung und Zentralisierung."
"18828";"17317";"1";"81386795687_10152695348475688";"data";"fetched (200)";"2016-10-09 20:25:24.949000";"Facebook:<user>/posts";"Wir gratulieren unserem Generalsekretär Andreas Scheuer  ganz herzlich zum 40. Geburtstag."
"18829";"17317";"1";"81386795687_10152694033415688";"data";"fetched (200)";"2016-10-09 20:25:24.949000";"Facebook:<user>/posts";"Das sind die Ergebnisse der Klausur der CSU-Landtagsfraktion:

Gymnasium weiterentwickeln! 
Lehrerbildung verbessern!
Kalte Progression abmildern!

Mehr dazu hier: http://bit.ly/1ussAuQ"
"18830";"17317";"1";"81386795687_10152693463480688";"data";"fetched (200)";"2016-10-09 20:25:24.949000";"Facebook:<user>/posts";"Generalsekretär Andreas Scheuer begrüßt die aktuelle Entscheidung des Bundesarbeitsgerichts zum Kopftuchverbot. Diese rechtliche Klarstellung wird unserer Kultur und den Wurzeln unseres Landes gerecht. Wir leben in einem christlich geprägten Land."
"18831";"17317";"1";"81386795687_10152691936620688";"data";"fetched (200)";"2016-10-09 20:25:24.949000";"Facebook:<user>/posts";"Edmund Stoiber will die EU zum dauerhaften Engagement gegen Bürokratie bewegen. In Kürze wird er seinen Abschlussbericht zum Bürokratieabbau in der EU vorlegen."
"18832";"17317";"1";"81386795687_10152691451415688";"data";"fetched (200)";"2016-10-09 20:25:24.949000";"Facebook:<user>/posts";"Innenminister Herrmann zu Islamisten: Wir haben eine tolerante Gesellschaft. Wenn jemand unterwegs ist, diese Toleranz, die Meinungsfreiheit, die Glaubensfreiheit in Frage zu stellen mit seinem Fanatismus, dann muss diese Gesellschaft sagen: Hier ist stopp!"
"18833";"17317";"1";"81386795687_10152690017090688";"data";"fetched (200)";"2016-10-09 20:25:24.949000";"Facebook:<user>/posts";"Bayernweite dimap-Studie: Bürger zufrieden mit bayerischem Bildungswesen! #BildungslandBayern

Mehr dazu: http://bit.ly/1CaP6cN"
"18834";"17317";"1";"81386795687_10152689593700688";"data";"fetched (200)";"2016-10-09 20:25:24.949000";"Facebook:<user>/posts";"Verkehrsminister Alexander Dobrindt,MdB verlangt Internet-Offensive der Bahn: Die Bahn muss sich auf die sich verändernden Lebensrealität der Menschen einstellen! 

Mehr zur Modernisierungs-Offensive findet Ihr hier: http://bit.ly/1ppYh08"
"18835";"17317";"1";"81386795687_10152688255060688";"data";"fetched (200)";"2016-10-09 20:25:24.949000";"Facebook:<user>/posts";"Klausurtagung der CSU-Fraktion im Bayerischen Landtag. Im Mittelpunkt steht das Thema Bildung. #BildungslandBayern"
"18836";"17317";"1";"81386795687_10152688029160688";"data";"fetched (200)";"2016-10-09 20:25:24.949000";"Facebook:<user>/posts";"Markus Sackmann zum 1. Bayerischen Ehrenamtsbotschafter ernannt. Er wird sich für die Stärkung des Ehrenamts einsetzen. In Bayern engagieren sich rund 3,8 Millionen Bürger ehrenamtlich. Sie sind eine tragende Säule des gesellschaftlichen Lebens.

Mehr zur Ernennung von Markus Sackmann und zur Stärkung des Ehrenamts findet ihr hier: bit.ly/1sUOVM5"
"18837";"17317";"1";"81386795687_10152683527840688";"data";"fetched (200)";"2016-10-09 20:25:24.949000";"Facebook:<user>/posts";"Andreas Scheuer sagt auf dem JU-Deutschlandtag zum Länderfinanzausgleich: 
„An die Adresse von Frau Kraft: Die Bayern-zahlt-die-Hälfte-Party muss jetzt endlich vorbei sein!“ #DLT14"
"18838";"17317";"1";"81386795687_10152681326835688";"data";"fetched (200)";"2016-10-09 20:25:24.949000";"Facebook:<user>/posts";"Asylkompromiss erzielt: Wir können nicht alle aufnehmen, die zu uns wollen. Wir als CSU sind froh, dass unsere Appelle Wirkung gezeigt haben und das grün-rote Baden-Württemberg die Blockade gegen die sinnvolle Begrenzung der Asylbewerber aufgegeben hat.

Mehr dazu hier: http://tinyurl.com/qg8jk8p"
"18839";"17317";"1";"81386795687_10152681019970688";"data";"fetched (200)";"2016-10-09 20:25:24.949000";"Facebook:<user>/posts";"Wir heißen die Junge Union Deutschlands recht herzlich in Bayern willkommen und wünschen allen Delegierten und Gästen einen erfolgreichen Deutschlandtag! #DLT14"
"18840";"17317";"1";"81386795687_10152678985595688";"data";"fetched (200)";"2016-10-09 20:25:24.949000";"Facebook:<user>/posts";"Der Bayernkurier wird nächstes Jahr 65 Jahre alt und wird zu diesem Jubiläum zu einem Monatsmagazin und einem tagesaktuellen Online-Nachrichtenportal. 

Was erwartet Ihr Euch von einem modernen Parteimagazin? Wir freuen uns über Eure Anregungen. #Bayernkurier2015"
"18841";"17317";"1";"81386795687_10152677258995688";"data";"fetched (200)";"2016-10-09 20:25:24.949000";"Facebook:<user>/posts";"Bayern hat gegen die Pläne zum Wegfall von Sanktionen gegen arbeitsunwillige Hartz-IV-Empfänger gestimmt!"
"18842";"17317";"1";"81386795687_10152676925250688";"data";"fetched (200)";"2016-10-09 20:25:24.949000";"Facebook:<user>/posts";"Partnerschaftsabkommen zwischen der EU und der Ukraine geschlossen."
"18843";"17317";"1";"81386795687_10152675667900688";"data";"fetched (200)";"2016-10-09 20:25:24.949000";"Facebook:<user>/posts";"Bayerns Wirtschaftsministerin Ilse Aigner findet: Die Selbstdarstellung der AfD ist falsch."
"18844";"17317";"1";"81386795687_10152674749585688";"data";"fetched (200)";"2016-10-09 20:25:24.949000";"Facebook:<user>/posts";"In Bayern beginnt ein neues Schuljahr. Wir wünschen allen Schülern und ihren Eltern einen guten Start."
"18845";"17317";"1";"81386795687_10152673386175688";"data";"fetched (200)";"2016-10-09 20:25:24.949000";"Facebook:<user>/posts";"Der CSU-Vorstand hat einen 7-Punkte-Sofortplan zur Asyl- und Flüchtlingspolitik beschlossen. Parteichef Horst Seehofer sagte: „Die Menschen wollen auf der einen Seite, dass wir solidarisch helfen, aber auf der anderen Seite auch, dass sich die Politik darum kümmert, dass die Gemeinden und Städte nicht überfordert werden und damit die Bevölkerung.“

Das komplette Programm findet ihr hier: http://bit.ly/1tWxss3 "
"18846";"17317";"1";"81386795687_10152672743020688";"data";"fetched (200)";"2016-10-09 20:25:24.949000";"Facebook:<user>/posts";"Gerade tagt der Parteivorstand der CSU. Heute auf der Tagesordnung: Sofortprogramm der CSU zur Asyl- und Flüchtlingspolitik und eine Analyse der Landtagswahlen in Thüringen und Brandenburg."
"18847";"17317";"1";"81386795687_10152671365585688";"data";"fetched (200)";"2016-10-09 20:25:24.949000";"Facebook:<user>/posts";"Thüringen hat gewählt: Die Union ist wieder stärkste Kraft! Wechselstimmung sieht anders aus, deshalb darf Thüringen kein linkes Versuchslabor werden!"
"18848";"17317";"1";"81386795687_10152666855195688";"data";"fetched (200)";"2016-10-09 20:25:24.949000";"Facebook:<user>/posts";"#CSUtvtipp: Generalsekretär Andreas Scheuer ist um 19:30 Uhr in der Berliner Runde in der ARD und diskutiert über die Auswirkungen der Wahlergebnisse in Thüringen und Brandenburg auf die Bundespolitik."
"18849";"17317";"1";"81386795687_10152670377515688";"data";"fetched (200)";"2016-10-09 20:25:24.949000";"Facebook:<user>/posts";"Der bayernweite Gedenktag für die Opfer von Flucht, Vertreibung und Deportation hat starke Symbolkraft: Wir setzen heute ein maßgebliches Zeichen für die Ächtung von Vertreibung und für die Wahrung der Menschenrechte."
"18850";"17317";"1";"81386795687_10152666593360688";"data";"fetched (200)";"2016-10-09 20:25:24.949000";"Facebook:<user>/posts";"Tracht auf der Regierungsbank: Grüne kritisieren Dirndl als rückständig.

Was denkt ihr darüber? Drückt auf „gefällt mir“ wenn ihr Dirndl super findet!"
"18851";"17317";"1";"CSU";"offcut";"fetched (200)";"2016-10-09 20:25:24.949000";"Facebook:<user>/posts";""
"18852";"17317";"1";"81386795687_10152664713300688";"data";"fetched (200)";"2016-10-09 20:25:27.270000";"Facebook:<user>/posts";""
"18853";"17317";"1";"81386795687_10152662798360688";"data";"fetched (200)";"2016-10-09 20:25:27.270000";"Facebook:<user>/posts";"Wir dürfen nicht sehenden Auges zulassen, dass die Konflikte des Nahen Ostens bewusst auch nach Europa und Deutschland hineingetragen werden. http://bit.ly/1rWqdjG"
"18854";"17317";"1";"81386795687_10152662288165688";"data";"fetched (200)";"2016-10-09 20:25:27.270000";"Facebook:<user>/posts";"Bayern macht es vor - wir sind Vorbild auch im Bund: Nach unserem Grundsatz wird der Bund im Jahr 2015 keine neuen Schulden machen - zum ersten Mal seit über vierzig Jahren!"
"18855";"17317";"1";"81386795687_10152661076220688";"data";"fetched (200)";"2016-10-09 20:25:27.270000";"Facebook:<user>/posts";"Bayern kämpft für den Bocksbeutel und will die traditionelle Flaschenform weiterhin schützen. Klickt auf „gefällt mir“, wenn ihr die Initiative unterstützt. 

Mehr dazu hier: http://bit.ly/YtSkdd"
"18856";"17317";"1";"81386795687_10152660944070688";"data";"fetched (200)";"2016-10-09 20:25:27.270000";"Facebook:<user>/posts";"Umfangreiches Maßnahmenpaket beschlossen: Bayern wird die Erstaufnahmeeinrichtungen für Flüchtlinge im Freistaat deutlich erweitern. 

Alle weiteren Punkte findet ihr hier: http://bit.ly/1trIpxD"
"18857";"17317";"1";"81386795687_10152660412860688";"data";"fetched (200)";"2016-10-09 20:25:27.270000";"Facebook:<user>/posts";"Menschen, die aus Kriegsgebieten zu uns kommen, müssen menschenwürdig untergebracht werden. Dafür braucht es eine gesamteuropäische Lösung."
"18858";"17317";"1";"81386795687_10152658419425688";"data";"fetched (200)";"2016-10-09 20:25:27.270000";"Facebook:<user>/posts";"Fair, gerecht und sinnvoll - Bundesverkehrsminister Alexander Dobrindt,MdB über sein Maut-Konzept. 
Mehr Infos zur aktuellen Debatte findet ihr hier: http://bit.ly/1qH2Gjc"
"18859";"17317";"1";"81386795687_10152652106235688";"data";"fetched (200)";"2016-10-09 20:25:27.270000";"Facebook:<user>/posts";"#CSUtvtipp: Ab 11:00 Uhr ist Horst Seehofer zu Gast beim Sonntagsstammtisch im Bayerischen Fernsehen. Schaut rein!"
"18860";"17317";"1";"81386795687_10152651892580688";"data";"fetched (200)";"2016-10-09 20:25:27.270000";"Facebook:<user>/posts";"Deutschland nimmt die humanitäre Verantwortung für Ausgebombte, Verfolgte, Vergewaltigte und Missbrauchte aus Krisengebieten mehr als jedes andere Land in Europa wahr. Unsere Städte und Gemeinden werden aber mit der explodierenden Zahl von Asylbewerbern kaum mehr fertig. http://bit.ly/Wk4nYw 

(Bild: dpa picture alliance)"
"18861";"17317";"1";"81386795687_10152649773895688";"data";"fetched (200)";"2016-10-09 20:25:27.270000";"Facebook:<user>/posts";"Die künftige bayerische Umweltministerin Ulrike Scharf will ihr neues Amt mit großer Leidenschaft antreten: „Der nachhaltige Umgang mit Ressourcen, die Bewahrung der Schöpfung, die Sicherung unserer Lebensgrundlagen - das ist die Richtschnur, in der ich mich bewegen möchte“ http://bit.ly/1rxiRAQ"
"18862";"17317";"1";"81386795687_10152649550490688";"data";"fetched (200)";"2016-10-09 20:25:27.270000";"Facebook:<user>/posts";"Bayerns Unternehmen sind weltweit aktiv zur Sicherung von Wachstum, Wohlstand und Arbeitsplätzen in Bayern. http://bit.ly/1qqFWoA"
"18863";"17317";"1";"81386795687_10152647804550688";"data";"fetched (200)";"2016-10-09 20:25:27.270000";"Facebook:<user>/posts";"Die heutigen Personalentscheidungen sind gut für Bayern. "
"18864";"17317";"1";"81386795687_10152647441710688";"data";"fetched (200)";"2016-10-09 20:25:27.270000";"Facebook:<user>/posts";"Ministerpräsident Horst Seehofer hat heute Staatsminister Dr. Marcel Huber die Aufgaben des Leiters der Staatskanzlei übertragen. Zur neuen Staatsministerin für Umwelt und Verbraucherschutz will er die CSU-Landtagsabgeordnete Ulrike Scharf berufen. Wir wünschen beiden viel Erfolg für ihr neues Amt."
"18865";"17317";"1";"81386795687_10152646781710688";"data";"fetched (200)";"2016-10-09 20:25:27.270000";"Facebook:<user>/posts";"CSU-Generalsekretär Andreas Scheuer fordert, dass deutschen ISIS-Kämpfern der deutsche Pass entzogen werden muss. Die Terroristen haben die Loyalität zu unserem Land aufgekündigt. http://bit.ly/1pHkLj4"
"18866";"17317";"1";"81386795687_10152645048065688";"data";"fetched (200)";"2016-10-09 20:25:27.270000";"Facebook:<user>/posts";"Das neue Ausbildungsjahr hat begonnen. Wir wünschen allen Auszubildenden einen guten Start ins Berufsleben! "
"18867";"17317";"1";"81386795687_10152644468180688";"data";"fetched (200)";"2016-10-09 20:25:27.270000";"Facebook:<user>/posts";"Wir nehmen den Rücktritt von Staatskanzleiministerin Christine Haderthauer mit Respekt zur Kenntnis. Wir danken ihr für ihre jahrelange Arbeit für Bayern und die CSU."
"18868";"17317";"1";"81386795687_10152641892040688";"data";"fetched (200)";"2016-10-09 20:25:27.270000";"Facebook:<user>/posts";"Mit den Stimmen der CSU hat der Bundestag heute beschlossen, das Vorgehen der Bundesregierung gegen die humanitäre Katastrophe im Irak zu unterstützen. Mehr dazu: http://bit.ly/1CjpjAl"
"18869";"17317";"1";"81386795687_10152641147425688";"data";"fetched (200)";"2016-10-09 20:25:27.270000";"Facebook:<user>/posts";"Für rund 100.000 Kindergartenkinder in Bayern heißt es jetzt wieder: auf geht’s in den Kindergarten! Sie erwarten beste Bedingungen in den Kindergärten. Knapp 70 Prozent der bayerischen Eltern sind mit den angebotenen Kindergartenplätzen zufrieden. http://bit.ly/Z4mUdr"
"18870";"17317";"1";"81386795687_10152633962510688";"data";"fetched (200)";"2016-10-09 20:25:27.270000";"Facebook:<user>/posts";"TV-Tipp: CSU Generalsekretär Andreas Scheuer ist ab 19:40 Uhr bei der Berliner Runde im ZDF zur Landtagswahl in Sachsen."
"18871";"17317";"1";"81386795687_10152631514890688";"data";"fetched (200)";"2016-10-09 20:25:27.270000";"Facebook:<user>/posts";"Der Missbrauch von Sozialleistungen durch Armutszuwanderung belastet unsere sozialen Sicherungssysteme und unsere Kommunen zunehmend. Die CSU hat dieses Thema als einzige Partei aufgegriffen, Vorschläge zur Bekämpfung unterbreitet und die zentralen Forderungen durchgesetzt. "
"18872";"17317";"1";"81386795687_10152630958535688";"data";"fetched (200)";"2016-10-09 20:25:27.270000";"Facebook:<user>/posts";"Auf Drängen Bayerns wird endlich ein bundesweiter Gedenktag für die Opfer von Flucht und Vertreibung eingeführt. Es ist ein wichtiges Signal an die Heimatvertriebenen, dass ihre jahrzehntelange Versöhnungsarbeit ernst genommen wird. http://bit.ly/1tYFFbC"
"18873";"17317";"1";"81386795687_10152626971585688";"data";"fetched (200)";"2016-10-09 20:25:27.270000";"Facebook:<user>/posts";"Ihr konntet nicht bei Lounge in the City dabei sein? Hier sind noch einmal die schönsten Momente der CSU-Afterworkparty im P1."
"18874";"17317";"1";"81386795687_10152624367625688";"data";"fetched (200)";"2016-10-09 20:25:27.270000";"Facebook:<user>/posts";"Generalsekretär Andreas Scheuer: „Das ist ein peinliches Sommertheater der Herren Laschet und Strobl. Ihre Einlassungen zeugen von tiefer Ahnungslosigkeit.“  "
"18875";"17317";"1";"81386795687_10152614952940688";"data";"fetched (200)";"2016-10-09 20:25:27.270000";"Facebook:<user>/posts";"Super Stimmung bei der AfterWorkParty der CSU im P1 in München!"
"18876";"17317";"1";"81386795687_10152612658410688";"data";"fetched (200)";"2016-10-09 20:25:27.270000";"Facebook:<user>/posts";"Schnellere Datenleitungen, höhere Sicherheit im Netz und mehr Neugründung von Internet-Firmen – mit diesen Kernpunkten will die Bundesregierung Deutschland an die weltweite Spitzenposition beim Breitbandausbau bringen. #DigitaleAgenda http://bit.ly/1odnElk "
"18877";"17317";"1";"CSU";"offcut";"fetched (200)";"2016-10-09 20:25:27.270000";"Facebook:<user>/posts";""
"18878";"17317";"1";"81386795687_10152612372795688";"data";"fetched (200)";"2016-10-09 20:25:29.748000";"Facebook:<user>/posts";"Morgen im P1 in München: Lounge in the City – AfterWorkParty. Habt Ihr Euch schon Euren Platz auf der Gästeliste gesichert? 
Einfach auf Teilnehmen klicken und morgen Abend im P1 dabei sein! "
"18879";"17317";"1";"81386795687_10152610562400688";"data";"fetched (200)";"2016-10-09 20:25:29.748000";"Facebook:<user>/posts";"Bayerns Schulen liegen im aktuellen Bildungsmonitor 2014 des Instituts der deutschen Wirtschaft bundesweit im Spitzenfeld. Es zeigt sich einmal mehr: Junge Menschen haben in Bayern überdurchschnittliche Bildungschancen! http://bit.ly/1uROckd"
"18880";"17317";"1";"81386795687_10152608207850688";"data";"fetched (200)";"2016-10-09 20:25:29.748000";"Facebook:<user>/posts";"Bayerns Finanzminister Markus Söder fordert für künftige innerdeutsche Finanzhilfen an verschuldete Bundesländer die Einführung einer Finanzaufsicht. Mehr dazu: http://bit.ly/YoPgPj
#Länderfinanzausgleich"
"18881";"17317";"1";"81386795687_10152598722215688";"data";"fetched (200)";"2016-10-09 20:25:29.748000";"Facebook:<user>/posts";"Neueste Erhebung des Statistischen Bundesamtes: Bayern befindet sich bei der Finanzkraft der Kommunen im bundesweiten Spitzenfeld. "
"18882";"17317";"1";"81386795687_10152594226975688";"data";"fetched (200)";"2016-10-09 20:25:29.748000";"Facebook:<user>/posts";"Generalsekretär Scheuer: ""Nach Erdogans Wahl können wir den EU-Beitritt der Türkei zu den Akten legen."""
"18883";"17317";"1";"81386795687_10152591828380688";"data";"fetched (200)";"2016-10-09 20:25:29.748000";"Facebook:<user>/posts";"Bayern will das umstrittene Fracking zur Gewinnung von Erdgas aus tiefen Gesteinsschichten mit Hilfe des Wasserrechts untersagen. Es gilt Seehofers Aussage aus dem Frühjahr 2014. Mehr dazu hier: http://bit.ly/1oDqnV1"
