"id";"parent_id";"level";"objectid";"objecttype";"querystatus";"querytime";"querytype";"message"
"19755";"17317";"1";"81386795687_273152582761210";"data";"fetched (200)";"2016-10-09 20:26:34.529000";"Facebook:<user>/posts";"Heute Nachmittag besucht uns Joachim Gauck und stellt sich vor. Wir haben Horst Seehofer schon einmal gefragt, worum es bei diesem Termin genau geht."
"19756";"17317";"1";"81386795687_362985987065416";"data";"fetched (200)";"2016-10-09 20:26:34.529000";"Facebook:<user>/posts";"In der Landesleitung tagt heute wieder unser Parteivorstand. Gerda Hasselfeldt berichtet uns, was heute auf der Agenda steht.
"
"19757";"17317";"1";"81386795687_10150668835080688";"data";"fetched (200)";"2016-10-09 20:26:53.618000";"Facebook:<user>/posts";"Fazit erste Runde Kleine Kommunalwahlen: Viele unserer Amtsinhaber wurden klar bestätigt und für die Stichwahlen in zwei Wochen haben sich die CSU-Kandidaten eine gute Ausgangslage geschaffen. Zum Beispiel in Landsberg am Lech, wo der amtierende SPD-Oberbürgermeister deutlich abgewählt wurde. Auf geht’s in die zweite Runde!"
"19758";"17317";"1";"81386795687_204310893009283";"data";"fetched (200)";"2016-10-09 20:26:53.618000";"Facebook:<user>/posts";""
"19759";"17317";"1";"81386795687_337811046265602";"data";"fetched (200)";"2016-10-09 20:26:53.618000";"Facebook:<user>/posts";"Am 11. März sind ""kleine Kommunalwahlen"". Dr. Michael Hohl ist unser Kandidat für Bayreuth. Mehr Informationen zu ihm findet ihr auf seiner Facebook-Seite.
"
"19760";"17317";"1";"CSU";"offcut";"fetched (200)";"2016-10-09 20:26:53.618000";"Facebook:<user>/posts";""
"19761";"17317";"1";"81386795687_238816926212706";"data";"fetched (200)";"2016-10-09 20:26:53.618000";"Facebook:<user>/posts";"Horst Seehofer hat uns nach dem Parteitag noch ein paar Fragen beantwortet. Hier jetzt exklusiv für Euch die Antworten."
"19762";"17317";"1";"81386795687_201039299997633";"data";"fetched (200)";"2016-10-09 20:26:53.618000";"Facebook:<user>/posts";""
"19763";"17317";"1";"81386795687_10150651836445688";"data";"fetched (200)";"2016-10-09 20:26:53.618000";"Facebook:<user>/posts";"""Bayern ist Benchmark"" - Herzlich willkommen, David McAllister, niedersächsicher Ministerpräsident!"
"19764";"17317";"1";"81386795687_10150651771630688";"data";"fetched (200)";"2016-10-09 20:26:53.618000";"Facebook:<user>/posts";"""Bayerns Kommunen - Bayerns Stärke"" - Kommunalpolitische Diskussionsrunde unter der Leitung der Stv. Generalsekretärin Dorothee Bär."
"19765";"17317";"1";"81386795687_348304401880265";"data";"fetched (200)";"2016-10-09 20:26:53.618000";"Facebook:<user>/posts";"Wir sind da. In Nürnberg, in Bayern, in Deutschland und in Europa."
"19766";"17317";"1";"81386795687_10150651710785688";"data";"fetched (200)";"2016-10-09 20:26:53.618000";"Facebook:<user>/posts";"Horst Seehofer spricht bei unserem kleinen Parteitag über Demokratie 2.0. Er fordert mehr Bürgerbeteiligung bei Grundsatzfragen zur Europäischen Union. Wie seht ihr das?"
"19767";"17317";"1";"81386795687_10150651639960688";"data";"fetched (200)";"2016-10-09 20:26:53.618000";"Facebook:<user>/posts";"Alexander Dobrindt eröffnet den Kleinen Parteitag: ""Unser kleiner Parteitag ist größer als die sog. großen Parteitage einiger anderer Parteien."""
"19768";"17317";"1";"81386795687_10150651637750688";"data";"fetched (200)";"2016-10-09 20:26:53.618000";"Facebook:<user>/posts";"Horst Seehofer und Alexander Dobrindt kommen beim Kleinen Parteitag in Nürnberg an."
"19769";"17317";"1";"81386795687_10150651598595688";"data";"fetched (200)";"2016-10-09 20:26:53.618000";"Facebook:<user>/posts";"""Im Dienst für unser Land"" - In knapp 15 Minuten gehts los."
"19770";"17317";"1";"81386795687_10150649657120688";"data";"fetched (200)";"2016-10-09 20:26:53.618000";"Facebook:<user>/posts";"Morgen findet in Nürnberg unser ""Kleiner Parteitag"" statt. Zwei große Themen sind die Kommunalpolitik und Europa. Ihr könnt natürlich auch wieder live dabei sein: In unserem Stream auf Facebook und auf Twitter mit dem Hashtag #kleipa12!"
"19771";"17317";"1";"81386795687_377304345620987";"data";"fetched (200)";"2016-10-09 20:26:53.618000";"Facebook:<user>/posts";"Am 11. März sind ""kleine Kommunalwahlen"". Dr. Harald Fichtner ist unser Kandidat für Hof. Seit er OB ist, wird in Hof wieder gestaltet und nicht mehr nur verwaltet. Dieser Weg muss konsequent weitergehen. Hier geht's zu seinem Facebook-Profil!
"
"19772";"17317";"1";"81386795687_283319125074627";"data";"fetched (200)";"2016-10-09 20:26:53.618000";"Facebook:<user>/posts";"Die Absenkung der Solarförderung ist heute Thema im Bundestag:
Wir wollen eine Änderung der Übergangsregelungen und besonders des Zeitplans erreichen. Die geplante Absenkung der Solarförderung, beginnend ab dem 9.März, ist nicht sachgerecht!
"
"19773";"17317";"1";"81386795687_10150644525840688";"data";"fetched (200)";"2016-10-09 20:26:53.618000";"Facebook:<user>/posts";"In Bayern finden am 11. März ""kleine Kommunalwahlen"" statt. Ab morgen stellen wir euch einige Kandidaten der CSU mit ihren Facebook-Profilen vor."
"19774";"17317";"1";"81386795687_279303718808480";"data";"fetched (200)";"2016-10-09 20:26:53.618000";"Facebook:<user>/posts";"Politischer Aschermittwoch. #Hach."
"19775";"17317";"1";"81386795687_10150640036870688";"data";"fetched (200)";"2016-10-09 20:26:53.618000";"Facebook:<user>/posts";"Glückwunsch an unseren Joachim Haller! Er ist neuer Bürgermeister in Bodenmais. Glück auf!"
"19776";"17317";"1";"81386795687_242643705824642";"data";"fetched (200)";"2016-10-09 20:26:53.618000";"Facebook:<user>/posts";"Ihr habt Einschlafschwierigkeiten? Dann haben wir einen Tipp für euch! Sagt's doch gleich euren Freunden weiter ;) !  "
"19777";"17317";"1";"81386795687_356349194387917";"data";"fetched (200)";"2016-10-09 20:26:53.618000";"Facebook:<user>/posts";"Herr Stoiber, wie war das eigentlich, nach 5 Jahren wieder in Passau zu reden? Wir haben gestern am Politischen Aschermittwoch für euch bei Edmund Stoiber nachgefragt!
"
"19778";"17317";"1";"81386795687_147232562064335";"data";"fetched (200)";"2016-10-09 20:26:53.618000";"Facebook:<user>/posts";"Hier gibts die ersten Fotos vom Politischen Aschermittwoch! Viel Spaß!"
"19779";"17317";"1";"81386795687_183857381716649";"data";"fetched (200)";"2016-10-09 20:26:53.618000";"Facebook:<user>/posts";"Ein erfolgreicher Politischer Aschermittwoch geht zu Ende. Wir bedanken uns bei allen, die dabei waren - zu Hause am Livestream oder am Tisch in der Halle! Bis zum nächsten Jahr!"
"19780";"17317";"1";"81386795687_10150631366160688";"data";"fetched (200)";"2016-10-09 20:26:53.618000";"Facebook:<user>/posts";"""Die CSU ist eine Partei mit bundesweitem und europaweitem Anspruch"" - Edmund Stoiber beim #csuam12. Er begrüßt die Halle: ""Liebe Freunde, die Südkurve steht!"""
"19781";"17317";"1";"81386795687_10150631290290688";"data";"fetched (200)";"2016-10-09 20:26:53.618000";"Facebook:<user>/posts";"""Wir müssen Chancen vererben und keine Schulden!"" - Horst Seehofer beim #csuam12"
"19782";"17317";"1";"81386795687_243356495751246";"data";"fetched (200)";"2016-10-09 20:26:55.003000";"Facebook:<user>/posts";""
"19783";"17317";"1";"81386795687_10150631186820688";"data";"fetched (200)";"2016-10-09 20:26:55.003000";"Facebook:<user>/posts";"Jetzt geht's los! Seid im Stream dabei, kommentiert und twittert fleißig mit. Der Hashtag lautet #csuam12! Viel Spaß beim Politischen Aschermittwoch 2012!"
"19784";"17317";"1";"81386795687_10150631131295688";"data";"fetched (200)";"2016-10-09 20:26:55.003000";"Facebook:<user>/posts";"40 Minuten vor Beginn des #csuam12 und die Halle ist voll!"
"19785";"17317";"1";"81386795687_184222865020657";"data";"fetched (200)";"2016-10-09 20:26:55.003000";"Facebook:<user>/posts";"Noch einmal Schlafen, dann ist es soweit! Morgen um 10 Uhr beginnt der Politische Aschermittwoch. Erste Eindrücke könnt Ihr schon einmal in unserem Video sehen. Seid morgen dabei: Vor Ort oder im Livestream!"
"19786";"17317";"1";"CSU";"offcut";"fetched (200)";"2016-10-09 20:26:55.003000";"Facebook:<user>/posts";""
"19787";"17317";"1";"81386795687_10150629563075688";"data";"fetched (200)";"2016-10-09 20:26:55.003000";"Facebook:<user>/posts";"Wir sind schon da! Wir hoffen, Ihr morgen auch. Wenn nicht, dann könnt Ihr den #csuam12 hier auch per Livestream verfolgen!"
"19788";"17317";"1";"81386795687_10150629406070688";"data";"fetched (200)";"2016-10-09 20:26:55.003000";"Facebook:<user>/posts";"Morgen ist es endlich soweit: Der Politische Aschermittwoch steht vor der Tür - und damit meinen wir natürlich nur das Original der CSU! Ihr seid auf dem Weg nach Passau? Dann schickt uns eure Fotos von eurem Aschermittwochs-Erlebnis: von der Anfahrt, vom Tisch oder vom Public Viewing. Die schönsten schaffen es in unsere Facebook-Galerie! Einfach direkt an fotos@csu-bayern.de schicken!"
"19789";"17317";"1";"81386795687_319743318075768";"data";"fetched (200)";"2016-10-09 20:26:55.003000";"Facebook:<user>/posts";"Joachim Gauck hat das Vertrauen der CSU und das Vertrauen der Bayern. Die Nominierung ist eine gute Entscheidung."
"19790";"17317";"1";"81386795687_239507199471169";"data";"fetched (200)";"2016-10-09 20:26:55.003000";"Facebook:<user>/posts";"Horst Seehofer spricht Christian Wulff ungeteilten Respekt für seine Entscheidung aus."
"19791";"17317";"1";"81386795687_190116164422448";"data";"fetched (200)";"2016-10-09 20:26:55.003000";"Facebook:<user>/posts";"Horst Seehofer zur geforderten Kinderlosen-Abgabe:"
"19792";"17317";"1";"81386795687_238994402853060";"data";"fetched (200)";"2016-10-09 20:26:55.003000";"Facebook:<user>/posts";""
"19793";"17317";"1";"81386795687_168932209885881";"data";"fetched (200)";"2016-10-09 20:26:55.003000";"Facebook:<user>/posts";"Warum sollte ein Politiker Angst vor einer Entscheidung der Bevölkerung haben? Warum nicht in Deutschland eine Tradition der Bürgerbeteiligung begründen und bei grundlegenden Entscheidung wie die Zustimmung zum Euro-Rettungsschirm die Bürger mitentscheiden lassen?
"
"19794";"17317";"1";"81386795687_10150598213055688";"data";"fetched (200)";"2016-10-09 20:26:55.003000";"Facebook:<user>/posts";"TV-Tipp: Horst Seehofer, Alexander Dobrindt und Dorothee Bär bei „Fastnacht in Franken“ - verkleidet. Ob ihr sie erkennt? Heute Abend um 19 Uhr könnt ihr es im BR versuchen!"
"19795";"17317";"1";"81386795687_10150598076115688";"data";"fetched (200)";"2016-10-09 20:26:55.003000";"Facebook:<user>/posts";"Der Countdown läuft: Nur noch 12 Tage bis zum Politischen Aschermittwoch. Seid dabei: mit einem Banner, einer Karte oder im Stream. Alle Infos gibt es auf unserer Fanseite. Das Banner des Tages kommt heute von Robin H. Danke für eure Ideen!"
"19796";"17317";"1";"81386795687_10150595652625688";"data";"fetched (200)";"2016-10-09 20:26:55.003000";"Facebook:<user>/posts";"Unser Banner des Tages kommt heute von Hans-Peter Bertl aus Weilheim. Habt auch ihr einen Spruch im Hinterkopf? Dann ab zu unserem Bannergenerator!"
"19797";"17317";"1";"81386795687_355509814467707";"data";"fetched (200)";"2016-10-09 20:26:55.003000";"Facebook:<user>/posts";"Ab heute gibt es auch eine bayerische 2-Euro-Münze! Mehr Bayern für einen starken Euro – das gefällt uns!"
"19798";"17317";"1";"81386795687_10150589579915688";"data";"fetched (200)";"2016-10-09 20:26:55.003000";"Facebook:<user>/posts";"Das heutige Banner des Tages! Wenn Ihr auch eine Idee habt, klickt auf unseren Bannergenerator."
"19799";"17317";"1";"81386795687_10150587601285688";"data";"fetched (200)";"2016-10-09 20:26:55.003000";"Facebook:<user>/posts";"Das Banner des Tages kommt heute aus der JU Rehau. Habt Ihr auch einen Vorschlag für die Banner zum Politischen Aschermittwoch? Dann ab zu unserem Bannergenerator!"
"19800";"17317";"1";"81386795687_183556541751158";"data";"fetched (200)";"2016-10-09 20:26:55.003000";"Facebook:<user>/posts";""
"19801";"17317";"1";"81386795687_296491083741658";"data";"fetched (200)";"2016-10-09 20:26:55.003000";"Facebook:<user>/posts";""
"19802";"17317";"1";"81386795687_10150579486980688";"data";"fetched (200)";"2016-10-09 20:26:55.003000";"Facebook:<user>/posts";"Ein weiterer Kreativpunkt geht an die JU Weilheim-Schongau! Habt auch Ihr einen Bannervorschlag? Dann ab auf unsere Fanseite!"
"19803";"17317";"1";"81386795687_10150577001640688";"data";"fetched (200)";"2016-10-09 20:26:55.003000";"Facebook:<user>/posts";"Das heutige Banner des Tages kommt von Kurt Eicher. Ihr habt auch einen Spruch auf den Lippen? Dann reicht ihn ein! Auf unserer Fanseite könnt Ihr unter dem Punkt ""Bannergenerator"" jede Menge Dampf ablassen."
"19804";"17317";"1";"81386795687_10150575148420688";"data";"fetched (200)";"2016-10-09 20:26:55.003000";"Facebook:<user>/posts";"Macht Euch einen Knoten ins Taschentuch, schreibt es in Euren Terminkalender oder tippt es in Euer Handy: In drei Wochen findet unser Politischer Aschermittwoch statt! Macht mit und entwerft ein eigenes Banner, das mit etwas Glück vor Ort ausgehängt wird. Also: Ab auf unsere Fanseite und den „Bannergenerator“ starten! Das heutige Banner des Tages kommt von der JU Weilheim-Schongau."
"19805";"17317";"1";"81386795687_276422502424654";"data";"fetched (200)";"2016-10-09 20:26:55.003000";"Facebook:<user>/posts";"Für diejenigen unter Euch, die gestern nicht im Livestream oder vor Ort am Europakongress teilnehmen konnten: Hier gibt's die Eröffnungsrede von Alexander Dobrindt. "
"19806";"17317";"1";"81386795687_260181167388004";"data";"fetched (200)";"2016-10-09 20:26:55.003000";"Facebook:<user>/posts";"Der Europakongress der CSU war ein voller Erfolg. Hier könnt Ihr noch einmal Eindrücke vom gestrigen Abend sehen."
"19807";"17317";"1";"81386795687_10150570109425688";"data";"fetched (200)";"2016-10-09 20:26:55.003000";"Facebook:<user>/posts";"Rege Beteiligung des Publikums bei der Diskussionsrunde auf dem Europakongress. Spannende Beiträge aus dem Plenum!"
"19808";"17317";"1";"81386795687_10150569913555688";"data";"fetched (200)";"2016-10-09 20:26:55.003000";"Facebook:<user>/posts";"""Bayern ist unsere Heimat, Deutschland unser Vaterland und Europa unsere Zukunft."""
"19809";"17317";"1";"81386795687_10150569612240688";"data";"fetched (200)";"2016-10-09 20:26:58.898000";"Facebook:<user>/posts";"In knapp 90 Minuten geht es los. Hier gehts zum Livestream: http://t.co/f3HFYSML"
"19810";"17317";"1";"81386795687_354854491211132";"data";"fetched (200)";"2016-10-09 20:26:58.898000";"Facebook:<user>/posts";"Einschalten nicht vergessen:"
"19811";"17317";"1";"81386795687_10150561322205688";"data";"fetched (200)";"2016-10-09 20:26:58.898000";"Facebook:<user>/posts";"Wir gedenken heute den Opfern des Nationalsozialismus."
"19812";"17317";"1";"CSU";"offcut";"fetched (200)";"2016-10-09 20:26:58.898000";"Facebook:<user>/posts";""
"19813";"17317";"1";"81386795687_10150559647980688";"data";"fetched (200)";"2016-10-09 20:26:58.898000";"Facebook:<user>/posts";"Was Europa jetzt braucht… diskutieren wir mit hochkarätigen Gästen auf unserem Europakongress am kommenden Montag. Natürlich könnt ihr hier auf facebook dabei sein: im Livestream ab 18 Uhr."
"19814";"17317";"1";"81386795687_169356613166759";"data";"fetched (200)";"2016-10-09 20:26:58.898000";"Facebook:<user>/posts";"Horst Seehofer: ""Wir geben nur so viel aus, wie wir einnehmen. Wir stärken Rücklagen und investieren in die Zukunft. Und wir tilgen Schulden. Mein Ziel ist ein schuldenfreies Bayern im Jahr 2030.""
"
"19815";"17317";"1";"81386795687_209003252528837";"data";"fetched (200)";"2016-10-09 20:26:58.898000";"Facebook:<user>/posts";"Ab 13 Uhr könnt Ihr die Regierungserklärung ""Lebensqualität sichern. Zukunft gewinnen. Aufbruch Bayern.""  live unter folgendem Link mitverfolgen.
"
"19816";"17317";"1";"81386795687_241265079284231";"data";"fetched (200)";"2016-10-09 20:26:58.898000";"Facebook:<user>/posts";"Die CSU bezieht in der Euro-Krise klar Position für ein Europa der Stabilität und der Schuldenbekämpfung und gegen ein Europa als Schuldenunion und Transfergemeinschaft. Mit dem Europakongress wollen wir die Debatte intensivieren.
"
"19817";"17317";"1";"81386795687_365074920184953";"data";"fetched (200)";"2016-10-09 20:26:58.898000";"Facebook:<user>/posts";"Ausgeglichener Haushalt? Geht schon sieben Mal in Folge! Schuldenfrei bis 2030? Warum soll das nicht gehen!"
"19818";"17317";"1";"81386795687_10150543930855688";"data";"fetched (200)";"2016-10-09 20:26:58.898000";"Facebook:<user>/posts";"Karl-Theodor zu Guttenberg wird sich 2013 nicht für ein politisches Mandat bewerben. Lest hier seinen persönlichen Brief an seine Parteifreunde."
"19819";"17317";"1";"81386795687_172260282880432";"data";"fetched (200)";"2016-10-09 20:26:58.898000";"Facebook:<user>/posts";"Unser Ziel: Bayern ist bis 2030 schuldenfrei. Schuldenabbau ist die beste Zukunftsvorsorge und Ausdruck echter Generationengerechtigkeit."
"19820";"17317";"1";"81386795687_238219932920470";"data";"fetched (200)";"2016-10-09 20:26:58.898000";"Facebook:<user>/posts";"""Bayern ist das Chancenland für junge Menschen."" Aus Kreuth berichtet Markus Blume, Vorsitzender der Jungen Gruppe der CSU-Fraktion, über die Wichtigkeit einer digitalen Infrastruktur und neue Möglichkeiten im digitalen Zeitalter."
"19821";"17317";"1";"81386795687_10150540088115688";"data";"fetched (200)";"2016-10-09 20:26:58.898000";"Facebook:<user>/posts";"Schaut rein: Heute um 20:15 Uhr diskutiert Alexander Dobrindt zur Rente mit 67 im ""BürgerForum live"" des BR."
"19822";"17317";"1";"81386795687_103484219775078";"data";"fetched (200)";"2016-10-09 20:26:58.898000";"Facebook:<user>/posts";"""Mehr Sicherheit für Bayerns Justizgebäude ist unumgänglich"" lautet die heutige Entschließung der CSU-Landtagsfraktion, die in Wildbad Kreuth verabschiedet wurde.
"
"19823";"17317";"1";"81386795687_322180434488729";"data";"fetched (200)";"2016-10-09 20:26:58.898000";"Facebook:<user>/posts";""
"19824";"17317";"1";"81386795687_254097071328499";"data";"fetched (200)";"2016-10-09 20:26:58.898000";"Facebook:<user>/posts";"Das Hightech-Land Bayern ist wieder mal Vorreiter in Zukunftstechnologien: Bayern und Sachsen wollen, dass in beiden Ländern bis 2020 250.000 Elektroautos fahren! "
"19825";"17317";"1";"81386795687_214050092019823";"data";"fetched (200)";"2016-10-09 20:26:58.898000";"Facebook:<user>/posts";"Die CSU-Landtags-Fraktion tagt momentan in Wildbad Kreuth. Hier könnt Ihr euch einige Einblicke verschaffen! Viel Spaß!"
"19826";"17317";"1";"81386795687_313246632047572";"data";"fetched (200)";"2016-10-09 20:26:58.898000";"Facebook:<user>/posts";""
"19827";"17317";"1";"81386795687_335354556484137";"data";"fetched (200)";"2016-10-09 20:26:58.898000";"Facebook:<user>/posts";""
"19828";"17317";"1";"81386795687_208253972600289";"data";"fetched (200)";"2016-10-09 20:26:58.898000";"Facebook:<user>/posts";"„Ich will, dass Bayern zu einem Land der unbegrenzten Chancen wird.“ Im Interview mit der Passauer Neuen Presse spricht Horst Seehofer unter anderem über die Notwendigkeit der Finanztransaktionssteuer, die Verbesserung der Beschäftigungsmöglichkeiten älterer Arbeitnehmer und das klare Nein zu Eurobonds. 
"
"19829";"17317";"1";"81386795687_350404034985892";"data";"fetched (200)";"2016-10-09 20:26:58.898000";"Facebook:<user>/posts";"Auf Bayern kommt es an! Neueste Umfrage bestätigt großes Vertrauen der Bayern in die CSU. Details findet Ihr in unserem Newsletter CSU-Topaktuell ..."
"19830";"17317";"1";"81386795687_158241617612076";"data";"fetched (200)";"2016-10-09 20:26:58.898000";"Facebook:<user>/posts";"Horst Seehofer: Die Rente mit 67 Jahren ist die richtige Antwort auf die demographische Herausforderung in Deutschland. Die Chancen für Arbeitnehmer ab 50 müssen aber spürbar verbessert werden."
"19831";"17317";"1";"81386795687_10150500910075688";"data";"fetched (200)";"2016-10-09 20:26:58.898000";"Facebook:<user>/posts";"Ein gutes neues Jahr. Wir wünschen Euch alles Gute und Erfolg für 2012!"
"19832";"17317";"1";"81386795687_346521655374962";"data";"fetched (200)";"2016-10-09 20:26:58.898000";"Facebook:<user>/posts";"Wir wünschen Euch einen guten Rutsch in das Jahr 2012!
"
"19833";"17317";"1";"81386795687_265462466851687";"data";"fetched (200)";"2016-10-09 20:26:58.898000";"Facebook:<user>/posts";"Wir kümmern uns um beste Bildung, faire Chancen für unsere Kinder, Einsatz für unsere Familien und eine starke bayerische Wirtschaft. Die Arbeitslosenquote (Nov. 3,3%)  in Bayern ist so niedrig wie seit Jahrzehnten nicht mehr. Zum siebten Mal in Folge wird nächstes Jahr der bayerische Haushalt ausgeglichen sein.
"
"19834";"17317";"1";"81386795687_268166219909799";"data";"fetched (200)";"2016-10-09 20:26:58.898000";"Facebook:<user>/posts";"CSU-Politik 2011 = Beste Bildungspolitik: Der ""Lernatlas 2011"" ist ein Top-Zeugnis für Bayerns Schüler, Studenten, Lehrer und die bayerische Bildungspolitik. Damit das auch so bleibt, investieren über ein Drittel des bayerischen Haushalts in Bildung."
"19835";"17317";"1";"81386795687_275527112497301";"data";"fetched (200)";"2016-10-09 20:26:58.898000";"Facebook:<user>/posts";"CSU-Politik 2011 = Echte Familienpolitik: Mit dem Betreuungsgeld haben Eltern die Wahl zwischen Erziehung zu Hause und Kita. Die Zahl der Betreuungsplätze für Kleinkinder in Bayern hat sich in fünf Jahren vervierfacht. "
"19836";"17317";"1";"81386795687_159789630795646";"data";"fetched (200)";"2016-10-09 20:27:01.592000";"Facebook:<user>/posts";"CSU-Politik 2011=Moderne Energiepolitik: Der Einstieg in die erneuerbaren Energien wird beschleunigt. Bis 2021 werden 50% des bayerischen Energiebedarfs regenerativ gedeckt."
"19837";"17317";"1";"81386795687_207103332710520";"data";"fetched (200)";"2016-10-09 20:27:01.592000";"Facebook:<user>/posts";"In unserem Jahresrückblick seht Ihr noch einmal wichtige Momente aus dem ""Jahr der Frau"". Danke für dieses ereignisreiche Jahr 2011!"
"19838";"17317";"1";"CSU";"offcut";"fetched (200)";"2016-10-09 20:27:01.592000";"Facebook:<user>/posts";""
"19839";"17317";"1";"81386795687_10150490859925688";"data";"fetched (200)";"2016-10-09 20:27:01.592000";"Facebook:<user>/posts";"CSU-Politik 2011 = Stabilitätspolitik: Unsere klaren Positionen haben sich durchgesetzt. Nein zu Eurobonds, ja zur Stabilitätskultur."
"19840";"17317";"1";"81386795687_10150484535525688";"data";"fetched (200)";"2016-10-09 20:27:01.592000";"Facebook:<user>/posts";"Wir wünschen Euch allen frohe Weihnachten und schöne Feiertage!"
"19841";"17317";"1";"81386795687_308267422536940";"data";"fetched (200)";"2016-10-09 20:27:01.592000";"Facebook:<user>/posts";"Lounge in the City 2011 - Danke, dass Ihr dabei wart."
"19842";"17317";"1";"81386795687_10150477685585688";"data";"fetched (200)";"2016-10-09 20:27:01.592000";"Facebook:<user>/posts";"Die CSU feiert noch einmal das Jahr der Frau 2011. Volles Haus bei der Lounge in the City Weihnachtsedition - der erfolgreichsten After-Work-Party Bayerns!"
"19843";"17317";"1";"81386795687_10150475408420688";"data";"fetched (200)";"2016-10-09 20:27:01.592000";"Facebook:<user>/posts";"Liebe Malgorzata Zajonz, herzlichen Glückwunsch: Du hast den letzten CSU-iPod unseres Foto-Wettbewerbs zum Thema ""Vorfreude"" gewonnen. Euch allen vielen Dank für Eure tollen Fotos."
"19844";"17317";"1";"81386795687_10150472843825688";"data";"fetched (200)";"2016-10-09 20:27:01.592000";"Facebook:<user>/posts";"Wir wünschen Euch einen schönen 4. Advent!"
"19845";"17317";"1";"81386795687_258472337547407";"data";"fetched (200)";"2016-10-09 20:27:01.592000";"Facebook:<user>/posts";"Echte Familienpolitik heißt echte Wahlfreiheit herstellen! Mit dem Betreuungsgeld UND dem Ausbau von Kita-Plätzen. Wer will stattdessen das Ehegattensplitting abschaffen und dadurch Familien benachteiligen, bei denen ein Elternteil für die Kindererziehung zu Hause bleibt? Genau... die Oppositionspartei."
"19846";"17317";"1";"81386795687_10150459505635688";"data";"fetched (200)";"2016-10-09 20:27:01.592000";"Facebook:<user>/posts";"Herzlichen Glückwunsch Simon Huber! Du hast den CSU-iPod gewonnen. Ab heute geht unser Gewinnspiel ""Dein Foto für's Christ-Kindle"" in die letzte Runde. Das Motto der Woche: Vorfreude! Also: Foto hochladen und mindestens 5 Stimmen sammeln! Wir freuen uns schon jetzt auf Eure Fotos!"
"19847";"17317";"1";"81386795687_10150457371375688";"data";"fetched (200)";"2016-10-09 20:27:01.592000";"Facebook:<user>/posts";"Es ist Endspurt angesagt: Noch bis 18 Uhr könnt Ihr Euer Foto zum Thema ""Tradition"" hochladen und einen iPod gewinnen. Denkt daran: Nur wer mehr als 5 Stimmen sammelt, nimmt an der Verlosung Teil. Morgen verraten wir Euch wieder den Gewinner. Viel Erfolg!"
"19848";"17317";"1";"81386795687_10150456754930688";"data";"fetched (200)";"2016-10-09 20:27:01.592000";"Facebook:<user>/posts";"Wir wünschen Euch einen schönen 3. Advent!"
"19849";"17317";"1";"81386795687_248448585218791";"data";"fetched (200)";"2016-10-09 20:27:01.592000";"Facebook:<user>/posts";"Beim EU-Gipfel in Brüssel hat Deutschland einen stabilen Euro durchgesetzt. Die CSU hat schon vor Wochen klar Position bezogen gegen Eurobonds und für die europaweite Schuldenbremse sowie für die automatische Durchsetzung von Sanktionen. Das hat sich ausgezahlt und dabei bleiben wir."
"19850";"17317";"1";"81386795687_10150451000395688";"data";"fetched (200)";"2016-10-09 20:27:01.592000";"Facebook:<user>/posts";"Wie Tradition in Ruhpolding gelebt wird, zeigt Daniel Bichler mit seinem Foto, das er beim Fotowettbewerb ""Dein Foto für's Christ-Kindle"" eingereicht hat. Wenn euch sein Foto gefällt, stimmt im Reiter ""Fotowettbewerb"" für ihn ab oder ladet selbst ein schönes Foto zum Wochenthema ""Tradition"" bis Sonntag, 18 Uhr, hoch! Viel Erfolg!"
"19851";"17317";"1";"81386795687_194133427340041";"data";"fetched (200)";"2016-10-09 20:27:01.592000";"Facebook:<user>/posts";"Das hier lohnt sich richtig zum Teilen, oder? "
